{"$schema":"https://json-schema.org/draft/2020-12/schema","title":"ExternalCaseEvidenceBinding","type":"object","required":["binding_version","binding_identity","case_id","package_id","p7_2_inventory_identity","p7_2_source_id","p7_2_artifact_id","p7_2_raw_trace_logical_path","p7_2_raw_trace_bytes","p7_2_raw_trace_sha256","p7_3_manifest_logical_path","p7_3_manifest_sha256","p7_3_source_identity","p7_3_artifact_identity","p7_3_package_identity","p7_3_report_logical_path","p7_3_report_sha256","p7_4_replay_report_logical_path","p7_4_replay_report_sha256","p7_4_source_identity","p7_4_reported_package_identity","p7_4_trace_identity","hardware_validation"],"properties":{"binding_version":{"const":"p7.3-p7.4-case-evidence-binding-v1","enum":["p7.3-p7.4-case-evidence-binding-v1"]},"binding_identity":{"type":"string","pattern":"^[0-9a-f]{64}$"},"case_id":{"type":"string","minLength":1,"pattern":"^[^/\\\\\u0000]+$"},"package_id":{"type":"string","minLength":1,"pattern":"^[^/\\\\\u0000]+$"},"p7_2_inventory_identity":{"type":"string","pattern":"^[0-9a-f]{64}$"},"p7_2_source_id":{"type":"string","minLength":1,"pattern":"^[^/\\\\\u0000]+$"},"p7_2_artifact_id":{"type":"string","minLength":1,"pattern":"^[^/\\\\\u0000]+$"},"p7_2_raw_trace_logical_path":{"type":"string","minLength":1,"pattern":"^(?!/)(?![A-Za-z]:)(?!.*//)(?!.*\\\\)(?!.*(^|/)\\.\\.?(/|$))(?!.*(^|/)(tmp|temp|temporary)(/|$)).+$"},"p7_2_raw_trace_bytes":{"type":"integer","minimum":0},"p7_2_raw_trace_sha256":{"type":"string","pattern":"^[0-9a-f]{64}$"},"p7_3_manifest_logical_path":{"type":"string","minLength":1,"pattern":"^(?!/)(?![A-Za-z]:)(?!.*//)(?!.*\\\\)(?!.*(^|/)\\.\\.?(/|$))(?!.*(^|/)(tmp|temp|temporary)(/|$)).+$"},"p7_3_manifest_sha256":{"type":"string","pattern":"^[0-9a-f]{64}$"},"p7_3_source_identity":{"type":"string","pattern":"^[0-9a-f]{64}$"},"p7_3_artifact_identity":{"type":"string","pattern":"^[0-9a-f]{64}$"},"p7_3_package_identity":{"type":"string","pattern":"^[0-9a-f]{64}$"},"p7_3_report_logical_path":{"type":"string","minLength":1,"pattern":"^(?!/)(?![A-Za-z]:)(?!.*//)(?!.*\\\\)(?!.*(^|/)\\.\\.?(/|$))(?!.*(^|/)(tmp|temp|temporary)(/|$)).+$"},"p7_3_report_sha256":{"type":"string","pattern":"^[0-9a-f]{64}$"},"p7_4_replay_report_logical_path":{"type":"string","minLength":1,"pattern":"^(?!/)(?![A-Za-z]:)(?!.*//)(?!.*\\\\)(?!.*(^|/)\\.\\.?(/|$))(?!.*(^|/)(tmp|temp|temporary)(/|$)).+$"},"p7_4_replay_report_sha256":{"type":"string","pattern":"^[0-9a-f]{64}$"},"p7_4_source_identity":{"type":"string","pattern":"^[0-9a-f]{64}$"},"p7_4_reported_package_identity":{"type":"string","pattern":"^[0-9a-f]{64}$"},"p7_4_trace_identity":{"type":"string","pattern":"^[0-9a-f]{64}$"},"hardware_validation":{"const":false,"enum":[false]}},"additionalProperties":false}
