{"binding_identity":"f80803eea21de187d93baa871b27df0e99a9e6432334830644be5c2f71eb2cbe","binding_version":"p7.3-p7.4-case-evidence-binding-v1","case_id":"freertos_btf_1core","hardware_validation":false,"p7_2_artifact_id":"btf_1core","p7_2_inventory_identity":"ad15a481e2dde8eea0ef2b6e3feecc083e30699532296f27d1095cacaedde54b","p7_2_raw_trace_bytes":101774,"p7_2_raw_trace_logical_path":"tests/python/fixtures/external_validation/sources/freertos_btf_trace/raw/example.btf","p7_2_raw_trace_sha256":"571183cbafba85f0eeb9c74cf2350f02a4e628abe514409dd3c1b68286969f44","p7_2_source_id":"freertos_btf_trace","p7_3_artifact_identity":"f49747aa05c3bfb437eddedf3d2234787a3aed19727cd99b80a14ea72ffb448b","p7_3_manifest_logical_path":"tests/python/fixtures/external_validation/packages/per_case/freertos_btf_1core/package_manifest.json","p7_3_manifest_sha256":"ac70cb5b90eb7d931583195e3a2206b21d50711a4bb553e98a82942e689fe4cc","p7_3_package_identity":"6853e36276ed9fe26e7db68c309ce612207bdfbf6c97f336e17b50b48715c3ab","p7_3_report_logical_path":"tests/python/fixtures/external_validation/packages/reports/per_case/freertos_btf_1core.json","p7_3_report_sha256":"bc15903acae6335699d3c40b561897e9694154707b1b475ce3160b23433fa7b3","p7_3_source_identity":"6fd28ac908077858b8d02847943a94560f8e3cccdcba5a94319646be5111b53f","p7_4_replay_report_logical_path":"tests/python/fixtures/external_validation/replay/reports/freertos_btf_1core.json","p7_4_replay_report_sha256":"c75143ce8c2c2ec689289a6e52848cb5c4fca42ce343f6710571075478708b8d","p7_4_reported_package_identity":"56fed592762f19719af928520c9454e52fb9ba5a7f05dfc897b48b70e55b3af5","p7_4_source_identity":"924efb7928adac4b8286c1218609440004c27cece04a108408839c5700723bee","p7_4_trace_identity":"571183cbafba85f0eeb9c74cf2350f02a4e628abe514409dd3c1b68286969f44","package_id":"p7.3.freertos_btf_1core.v1"}
