{"binding_identity":"673bf36b77b87779a57e0d3a3a7414b313a9cbf302c3208b508e58518556a1cf","binding_version":"p7.3-p7.4-case-evidence-binding-v1","case_id":"freertos_btf_4cores","hardware_validation":false,"p7_2_artifact_id":"btf_4cores","p7_2_inventory_identity":"ad15a481e2dde8eea0ef2b6e3feecc083e30699532296f27d1095cacaedde54b","p7_2_raw_trace_bytes":1157633,"p7_2_raw_trace_logical_path":"tests/python/fixtures/external_validation/sources/freertos_btf_trace/raw/example-4cores.btf","p7_2_raw_trace_sha256":"eb15beee65c62d53a3bbf9db5ebb36318156b720e4bd909272605dfeb1c6eed1","p7_2_source_id":"freertos_btf_trace","p7_3_artifact_identity":"6955559e449caf06de35c0fcc63a6c9f6ce09ff666e9a5139ca5ae8e935fbe87","p7_3_manifest_logical_path":"tests/python/fixtures/external_validation/packages/per_case/freertos_btf_4cores/package_manifest.json","p7_3_manifest_sha256":"698862702db6ec392ee08a974bfbd8617089b37060602c3b9f5f9a16917ffcb6","p7_3_package_identity":"44f5d5df393d05cd4a836605e585a6989f8307dbe22aef7f0e722601856a5613","p7_3_report_logical_path":"tests/python/fixtures/external_validation/packages/reports/per_case/freertos_btf_4cores.json","p7_3_report_sha256":"bde9db2e4321f935d38fdcfaebc834273794f6c3172271fd595ec492bf952e1f","p7_3_source_identity":"90ed183bf1177be69a851011c09647cef0a6c65fb550599c01c776c5ecf92c97","p7_4_replay_report_logical_path":"tests/python/fixtures/external_validation/replay/reports/freertos_btf_4cores.json","p7_4_replay_report_sha256":"199aacdc0d1341d4fd799da10d1405e034065da13fa2bfbc865af1358e53fc24","p7_4_reported_package_identity":"56fed592762f19719af928520c9454e52fb9ba5a7f05dfc897b48b70e55b3af5","p7_4_source_identity":"924efb7928adac4b8286c1218609440004c27cece04a108408839c5700723bee","p7_4_trace_identity":"eb15beee65c62d53a3bbf9db5ebb36318156b720e4bd909272605dfeb1c6eed1","package_id":"p7.3.freertos_btf_4cores.v1"}
